<?xml version="1.0" encoding="utf-8"?>
<configuration  xmlns="https://github.com/daiqiaobing/mango-core" xmlns:xsi="http://www.w3.org/2001/XMLSchema-instance"
        xsi:schemaLocation="https://github.com/daiqiaobing/mango-core https://github.com/daiqiaobing/mango-core/blob/dev/src/main/resource/mango-core.xsd"  >

    <title>配置文件</title>

    <property>
        <key>aoi</key>
        <value>test.properties</value>
        <type>property</type>
        <scope>global</scope>
    </property>

    <property>
        <key>aoi1</key>
        <value>test.yaml</value>
        <type>yaml</type>
        <scope>global</scope>
    </property>
</configuration>
